{
  "resolvedAssetUri": "urn:ipproto:asset:7c4f9a82-3e15-4d0a-9f62-1b8c5e23a4d8",
  "resolvedAt": "2026-04-28T07:20:00Z",
  "confidenceLevel": "exact",
  "resolutionMethod": "familyLookup",
  "resolutionBasis": {
    "source": "epoOps",
    "matchedIdentifiers": [
      {
        "officeCode": "EP",
        "value": "EP3987654",
        "kindCode": "A1"
      }
    ],
    "docdbFamilyId": "DOCDB-78451203"
  },
  "inputIdentifiers": [
    {
      "scheme": "urn:ipproto:scheme:office-publication",
      "officeCode": "EP",
      "value": "EP3987654",
      "kindCode": "A1"
    }
  ]
}
